{
  "$schema": "https://json-schema.org/draft/2020-12/schema",
  "$id": "https://leji.org/schemas/v1.0/context-index.schema.json",
  "title": "Leji context index",
  "description": "Generated map of the context layer. Never hand-maintained; regenerate on change.",
  "type": "object",
  "required": [
    "schemaVersion",
    "generatedAt",
    "rootPath",
    "entries"
  ],
  "additionalProperties": false,
  "properties": {
    "$schema": {
      "description": "Optional pointer to this schema, for editor validation and tooling.",
      "type": "string"
    },
    "schemaVersion": {
      "description": "The Leji spec line this artifact was written against, e.g. \"1.0\".",
      "type": "string",
      "pattern": "^\\d+\\.\\d+$"
    },
    "generatedAt": {
      "description": "ISO 8601 timestamp when the index was generated.",
      "type": "string",
      "pattern": "^\\d{4}-(0[1-9]|1[0-2])-(0[1-9]|[12]\\d|3[01])[T ].+$"
    },
    "generator": {
      "description": "The tool that generated this index.",
      "type": "object",
      "additionalProperties": false,
      "properties": {
        "name": {
          "description": "Name of the generating tool, e.g. \"leji\".",
          "type": "string"
        },
        "version": {
          "description": "Version of the generating tool.",
          "type": "string"
        }
      }
    },
    "rootPath": {
      "description": "The context layer root this index was generated for; mirrors the manifest's rootPath. Entry paths are repository-root-relative, not re-based under it.",
      "type": "string",
      "pattern": "^(?!/)(?!\\./)(?!.*(^|/)\\.\\.(/|$))(?!.*\\\\).*$"
    },
    "entries": {
      "description": "One entry per indexed document in the context layer. Each `id` and each `path` is unique across entries; the reference validator enforces this (JSON Schema cannot, since the constraint is on a sub-field, not the whole object).",
      "type": "array",
      "items": {
        "type": "object",
        "required": [
          "id",
          "path",
          "title",
          "category"
        ],
        "additionalProperties": false,
        "properties": {
          "id": {
            "description": "Stable identifier; renames and moves update the path, never the id.",
            "type": "string",
            "pattern": "^[a-z0-9]+(-[a-z0-9]+)*$"
          },
          "path": {
            "description": "Repository-root-relative path to the document.",
            "type": "string",
            "pattern": "^(?!/)(?!\\./)(?!.*(^|/)\\.\\.(/|$))(?!.*\\\\).+$"
          },
          "title": {
            "description": "Human-readable title, from the document's first heading or frontmatter.",
            "type": "string",
            "minLength": 1
          },
          "category": {
            "description": "Which content category this document belongs to.",
            "enum": [
              "domain",
              "system",
              "practice",
              "governance",
              "decisions"
            ]
          },
          "kind": {
            "description": "Whether the document is maintained present truth (intent) or dated evidence (record). Absent means intent.",
            "enum": [
              "intent",
              "record"
            ]
          },
          "date": {
            "description": "A record's date, sourced only from valid frontmatter date.",
            "pattern": "^\\d{4}-(0[1-9]|1[0-2])-(0[1-9]|[12]\\d|3[01])$",
            "type": "string"
          },
          "summary": {
            "description": "One-line summary of the document, for routing and navigation.",
            "type": "string"
          },
          "tags": {
            "description": "Optional free-form tags.",
            "type": "array",
            "items": {
              "type": "string"
            }
          },
          "owners": {
            "description": "Optional owners of this document.",
            "type": "array",
            "items": {
              "type": "string"
            }
          },
          "lastModified": {
            "description": "ISO 8601 date the document last changed, from version control where available.",
            "type": "string",
            "pattern": "^\\d{4}-(0[1-9]|1[0-2])-(0[1-9]|[12]\\d|3[01])([T ].*)?$"
          },
          "contentHash": {
            "description": "Hash of the document's contents, used to detect drift and stable moves.",
            "type": "string"
          },
          "freshness": {
            "description": "Review horizon for this document.",
            "type": "object",
            "additionalProperties": false,
            "properties": {
              "reviewAfter": {
                "description": "ISO 8601 date after which the document should be reviewed for staleness.",
                "type": "string",
                "pattern": "^\\d{4}-(0[1-9]|1[0-2])-(0[1-9]|[12]\\d|3[01])$"
              }
            }
          },
          "links": {
            "description": "Optional outbound references from this document.",
            "type": "array",
            "items": {
              "type": "string"
            }
          }
        }
      }
    },
    "mounts": {
      "description": "Routing records for federated sibling context layers, derived from the manifest's federation.mounts (spec: distribution.md, machine-readable-surface.md). Routing metadata only: tooling MUST NOT copy a sibling's index entries or prose here. A mount record never discloses what the host's audience may not see.",
      "type": "array",
      "items": {
        "type": "object",
        "required": [
          "name",
          "source",
          "pin",
          "owner"
        ],
        "additionalProperties": false,
        "properties": {
          "name": {
            "description": "The sibling layer's name; matches the name in the sibling's own manifest.",
            "type": "string",
            "minLength": 1
          },
          "source": {
            "description": "Normalized repository locator of the sibling layer.",
            "type": "string",
            "minLength": 1
          },
          "pin": {
            "description": "Full immutable commit id (SHA-1 or SHA-256) of the sibling revision the host reads.",
            "type": "string",
            "pattern": "^([0-9a-f]{40}|[0-9a-f]{64})$"
          },
          "trackingRef": {
            "description": "Fully qualified witness ref reachability and staleness are compared against, when declared.",
            "type": "string",
            "pattern": "^refs/(heads|tags)/.+$"
          },
          "owner": {
            "description": "The owner of the sibling layer.",
            "type": "object",
            "required": [
              "name"
            ],
            "additionalProperties": false,
            "properties": {
              "name": {
                "type": "string",
                "minLength": 1
              },
              "contact": {
                "type": "string"
              }
            }
          },
          "role": {
            "description": "Prose description of what the sibling carries.",
            "type": "string"
          },
          "categories": {
            "description": "Content-category scopes this sibling can answer for.",
            "type": "array",
            "items": {
              "enum": [
                "domain",
                "system",
                "practice",
                "governance",
                "decisions"
              ]
            }
          },
          "topics": {
            "description": "Short topic labels for relevance routing.",
            "type": "array",
            "items": {
              "type": "string",
              "minLength": 1
            }
          },
          "requiredWhen": {
            "description": "Task conditions under which a reader must resolve this mount or fail closed.",
            "type": "array",
            "items": {
              "type": "string",
              "minLength": 1
            }
          }
        }
      }
    }
  }
}
