{
  "$schema": "https://leji.org/schemas/v1.0/context-index.schema.json",
  "schemaVersion": "1.0",
  "generatedAt": "2026-09-27T13:13:25.143Z",
  "generator": {
    "name": "leji",
    "version": "1.5.2"
  },
  "rootPath": "docs/",
  "entries": [
    {
      "id": "adopt-leji",
      "path": "docs/decisions/0001-adopt-leji.md",
      "title": "Adopt the Leji context layer",
      "category": "decisions",
      "kind": "record",
      "date": "2026-06-18",
      "lastModified": "2026-06-22",
      "contentHash": "sha256:ae3cedfeb931eec4"
    },
    {
      "id": "raise-to-governed",
      "path": "docs/decisions/0002-raise-to-governed.md",
      "title": "Raise the Leji context layer to governed conformance",
      "category": "decisions",
      "kind": "record",
      "date": "2026-06-21",
      "lastModified": "2026-06-22",
      "contentHash": "sha256:66eb91ecee293b8d",
      "links": [
        "0001-adopt-leji.md"
      ]
    },
    {
      "id": "category-index-files",
      "path": "docs/decisions/0003-category-index-files.md",
      "title": "Map categories to curated index files and derive the viewer from the repository tree",
      "category": "decisions",
      "kind": "record",
      "date": "2026-06-23",
      "lastModified": "2026-07-30",
      "contentHash": "sha256:5d955913ad1b6c64",
      "links": [
        "0001-adopt-leji.md"
      ]
    },
    {
      "id": "declare-spec-1-0-ga",
      "path": "docs/decisions/0004-declare-spec-1-0-ga.md",
      "title": "Declare spec 1.0 GA and freeze the line",
      "category": "decisions",
      "kind": "record",
      "date": "2026-07-01",
      "lastModified": "2026-07-30",
      "contentHash": "sha256:72e1f9877a963ad0",
      "links": [
        "0003-category-index-files.md"
      ]
    },
    {
      "id": "solo-working-mode",
      "path": "docs/decisions/0005-solo-working-mode.md",
      "title": "Add a solo working mode with an owner interview and artifact-drop onboarding",
      "category": "decisions",
      "kind": "record",
      "date": "2026-07-16",
      "lastModified": "2026-07-30",
      "contentHash": "sha256:b848301549ed3708"
    },
    {
      "id": "agents-md-discovery-adapter",
      "path": "docs/decisions/0006-agents-md-discovery-adapter.md",
      "title": "Recognize AGENTS.md as the portable discovery adapter and generate it by default",
      "category": "decisions",
      "kind": "record",
      "date": "2026-07-17",
      "lastModified": "2026-07-30",
      "contentHash": "sha256:a233a436f4d7a9d6"
    },
    {
      "id": "commercial-hosted-viewer",
      "path": "docs/decisions/0007-commercial-hosted-viewer.md",
      "title": "Commercial hosted viewer and governance language change",
      "category": "decisions",
      "kind": "record",
      "date": "2026-08-08",
      "lastModified": "2026-08-21",
      "contentHash": "sha256:eccda61bc46e9045",
      "links": [
        "0004-declare-spec-1-0-ga.md"
      ]
    },
    {
      "id": "dependency-pinning-and-refresh",
      "path": "docs/decisions/0008-dependency-pinning-and-refresh.md",
      "title": "Dependency pinning and refresh policy",
      "category": "decisions",
      "kind": "record",
      "date": "2026-08-24",
      "lastModified": "2026-09-27",
      "contentHash": "sha256:eb503b14a1cb17b4"
    },
    {
      "id": "glossary",
      "path": "docs/domain/glossary.md",
      "title": "Glossary",
      "category": "domain",
      "kind": "intent",
      "summary": "What the core terms of this repository mean, in our own words.",
      "lastModified": "2026-06-22",
      "contentHash": "sha256:3f481c1cd47e78dd",
      "freshness": {
        "reviewAfter": "2027-06-21"
      }
    },
    {
      "id": "porting-ts-to-go-py",
      "path": "docs/practice/porting-ts-to-go-py.md",
      "title": "Porting to Go & Python",
      "category": "practice",
      "kind": "intent",
      "summary": "How to port a change from the TypeScript reference SDK to the Go and Python SDKs without breaking parity.",
      "lastModified": "2026-09-27",
      "contentHash": "sha256:83559d7314b0420f",
      "freshness": {
        "reviewAfter": "2026-12-21"
      }
    },
    {
      "id": "testing-cli-adoptions",
      "path": "docs/practice/testing-cli-adoptions.md",
      "title": "CLI Testing (LIVE/PACKED)",
      "category": "practice",
      "kind": "intent",
      "summary": "The two evidence channels for testing the leji CLI against real repositories, LIVE (linked source) and PACKED (installed artifact), and the discipline for using them.",
      "lastModified": "2026-09-27",
      "contentHash": "sha256:ada76a2d7ffac5e2",
      "freshness": {
        "reviewAfter": "2026-12-21"
      }
    },
    {
      "id": "trust-boundary",
      "path": "docs/practice/trust-boundary.md",
      "title": "The Trust Boundary",
      "category": "practice",
      "kind": "intent",
      "summary": "What the leji CLI guarantees about where it writes and what it reads, and the one mechanism in each SDK that holds the guarantee.",
      "lastModified": "2026-09-27",
      "contentHash": "sha256:1a849fe6e2f13e01",
      "freshness": {
        "reviewAfter": "2027-02-17"
      }
    },
    {
      "id": "invariants",
      "path": "docs/system/invariants.md",
      "title": "System Invariants",
      "category": "system",
      "kind": "intent",
      "summary": "The constraints every change to this repository lives with.",
      "lastModified": "2026-08-21",
      "contentHash": "sha256:3c77b60c6e9ff670",
      "freshness": {
        "reviewAfter": "2027-06-21"
      }
    }
  ]
}
