{
  "$schema": "https://leji.org/schemas/v1.0/context-index.schema.json",
  "schemaVersion": "1.0",
  "generatedAt": "2026-07-31T12:23:37.412Z",
  "generator": {
    "name": "leji",
    "version": "1.3.1"
  },
  "rootPath": "docs/",
  "entries": [
    {
      "id": "adopt-leji",
      "path": "docs/decisions/0001-adopt-leji.md",
      "title": "Adopt the Leji context layer",
      "category": "decisions",
      "kind": "record",
      "date": "2026-06-10",
      "lastModified": "2026-06-17",
      "contentHash": "sha256:9680ba24ad268894"
    },
    {
      "id": "glossary",
      "path": "docs/domain/glossary.md",
      "title": "Glossary",
      "category": "domain",
      "kind": "intent",
      "summary": "What invoice, credit note, and settlement mean at Acme.",
      "lastModified": "2026-06-17",
      "contentHash": "sha256:22d9bcc4fe0ce860"
    },
    {
      "id": "system-invariants",
      "path": "docs/system/invariants.md",
      "title": "System Invariants",
      "category": "system",
      "kind": "intent",
      "summary": "Money handling, ledger append-only rule, service boundaries.",
      "lastModified": "2026-06-17",
      "contentHash": "sha256:6e179b4fa71bd5ad",
      "freshness": {
        "reviewAfter": "2026-12-10"
      }
    }
  ]
}
